{
  "catalog_id": "g8.ontology.finance.v1",
  "catalog_version": 1,
  "status": "SPEC_ACCEPTED",
  "coa_pin_sha256": "607e37da8aa8e05687c9898cc1577db070c082ece8281c7bd3a43e725aac73df",
  "interfaces": [
    {
      "api_name": "IResource",
      "properties": [
        { "name": "id", "value_type": "string", "required": true },
        { "name": "type", "value_type": "string", "required": true },
        { "name": "tenant_id", "value_type": "string", "required": true },
        { "name": "version_id", "value_type": "string", "required": true },
        { "name": "authority_state", "value_type": "enum:CANDIDATE|REVIEWED|ACCEPTED|REJECTED|SUPERSEDED|WITHDRAWN", "required": true },
        { "name": "epistemic", "value_type": "enum:OBSERVED|DERIVED|INFERRED|UNAVAILABLE", "required": true },
        { "name": "valid_from", "value_type": "datetime" },
        { "name": "valid_to", "value_type": "datetime" },
        { "name": "known_at", "value_type": "datetime" },
        { "name": "recorded_at", "value_type": "datetime" }
      ]
    },
    { "api_name": "IVersioned", "properties": [{ "name": "supersedes_version_id", "value_type": "string" }] },
    { "api_name": "IIdentified", "properties": [{ "name": "display_name", "value_type": "string", "required": true }] },
    { "api_name": "ISourced", "properties": [{ "name": "source_record_ids", "value_type": "string[]", "required": true }] },
    { "api_name": "IDimensioned", "properties": [{ "name": "dimension_bindings", "value_type": "DimensionBinding[]" }] },
    { "api_name": "IMonetary", "properties": [
      { "name": "amount", "value_type": "decimal_string", "required": true },
      { "name": "currency_id", "value_type": "string", "required": true },
      { "name": "scale", "value_type": "integer", "required": true }
    ]},
    { "api_name": "IAlignable", "properties": [{ "name": "alignment_ids", "value_type": "string[]" }] },
    { "api_name": "IPublishable", "properties": [{ "name": "publication_id", "value_type": "string" }] },
    { "api_name": "IQueryable", "properties": [] }
  ],
  "object_types": [
    {
      "api_name": "LegalEntity",
      "type_group": "g8.enterprise",
      "implements": ["IResource", "IIdentified", "IVersioned", "IAlignable"],
      "primary_key": "id",
      "title_property": "legal_name",
      "properties": [
        { "name": "legal_name", "value_type": "string", "required": true },
        { "name": "short_code", "value_type": "string" },
        { "name": "registration_id", "value_type": "string" },
        { "name": "tax_id", "value_type": "string" },
        { "name": "functional_currency_id", "value_type": "string", "required": true },
        { "name": "is_consolidation_parent", "value_type": "boolean" },
        { "name": "domain_pack", "value_type": "enum:PETROLEUM|GAS|SHARED_FINANCE|NONE" }
      ]
    },
    {
      "api_name": "EnterpriseGroup",
      "type_group": "g8.enterprise",
      "implements": ["IResource", "IIdentified"],
      "primary_key": "id",
      "title_property": "legal_name",
      "properties": [
        { "name": "legal_name", "value_type": "string", "required": true },
        { "name": "presentation_currency_id", "value_type": "string" }
      ]
    },
    {
      "api_name": "Ledger",
      "type_group": "g8.finance",
      "implements": ["IResource", "IIdentified"],
      "primary_key": "id",
      "title_property": "code",
      "properties": [
        { "name": "legal_entity_id", "value_type": "string", "required": true },
        { "name": "code", "value_type": "string", "required": true },
        { "name": "book_kind", "value_type": "enum:STATUTORY|TAX|MANAGEMENT|BUDGET|CONSOLIDATION", "required": true }
      ]
    },
    {
      "api_name": "FiscalPeriod",
      "type_group": "g8.time",
      "implements": ["IResource"],
      "primary_key": "id",
      "title_property": "code",
      "properties": [
        { "name": "code", "value_type": "string", "required": true },
        { "name": "kind", "value_type": "enum:MONTH|YEAR", "required": true },
        { "name": "start_date", "value_type": "date", "required": true },
        { "name": "end_date", "value_type": "date", "required": true },
        { "name": "is_closed", "value_type": "boolean" }
      ]
    },
    {
      "api_name": "ScenarioVersion",
      "type_group": "g8.time",
      "implements": ["IResource", "IIdentified"],
      "primary_key": "id",
      "title_property": "code",
      "properties": [
        { "name": "code", "value_type": "string", "required": true },
        { "name": "kind", "value_type": "enum:ACTUAL|BUDGET|FORECAST|ADJUSTMENT", "required": true }
      ]
    },
    {
      "api_name": "Currency",
      "type_group": "g8.money",
      "implements": ["IResource"],
      "primary_key": "id",
      "title_property": "iso_code",
      "properties": [
        { "name": "iso_code", "value_type": "string", "pattern": "^[A-Z]{3}$", "required": true }
      ]
    },
    {
      "api_name": "Party",
      "type_group": "g8.party",
      "implements": ["IResource", "IIdentified", "IAlignable"],
      "primary_key": "id",
      "title_property": "display_name",
      "properties": [
        { "name": "party_kind", "value_type": "enum:LEGAL_ENTITY|COUNTERPARTY|EMPLOYEE|REGULATOR|OTHER", "required": true },
        { "name": "tax_id", "value_type": "string" }
      ]
    },
    {
      "api_name": "Product",
      "type_group": "g8.product",
      "implements": ["IResource", "IIdentified"],
      "primary_key": "id",
      "title_property": "display_name",
      "properties": [
        { "name": "unit_id", "value_type": "string" },
        { "name": "family", "value_type": "enum:PETROL|DIESEL|BITUMEN|CNG|LPG|NATURAL_GAS|OTHER|UNKNOWN" },
        { "name": "channel", "value_type": "enum:WHOLESALE|RETAIL|SOCIAL|COMMERCIAL|DISTRIBUTION|OTHER|UNKNOWN" },
        { "name": "restricted_entity_id", "value_type": "string" }
      ]
    },
    {
      "api_name": "Segment",
      "type_group": "g8.product",
      "implements": ["IResource"],
      "primary_key": "id",
      "title_property": "code",
      "properties": [
        { "name": "code", "value_type": "enum:SOCIAL|COMMERCIAL_RETAIL|COMMERCIAL_WHOLESALE|DISTRIBUTION|CORPORATE|OTHER", "required": true }
      ]
    },
    {
      "api_name": "LocalChartOfAccounts",
      "type_group": "g8.finance",
      "implements": ["IResource", "ISourced"],
      "primary_key": "id",
      "title_property": "id",
      "properties": [
        { "name": "legal_entity_id", "value_type": "string" },
        { "name": "source_hash", "value_type": "sha256", "required": true },
        { "name": "account_count_observed", "value_type": "integer" }
      ]
    },
    {
      "api_name": "LocalAccount",
      "type_group": "g8.finance",
      "implements": ["IResource", "IIdentified", "ISourced"],
      "primary_key": "id",
      "title_property": "code",
      "properties": [
        { "name": "chart_id", "value_type": "string", "required": true },
        { "name": "code", "value_type": "string", "required": true },
        { "name": "name_ka", "value_type": "string" },
        { "name": "name_ru", "value_type": "string" },
        { "name": "nature", "value_type": "enum:A|P|AP" },
        { "name": "off_balance", "value_type": "boolean" },
        { "name": "currency_flag", "value_type": "boolean" },
        { "name": "quantity_flag", "value_type": "boolean" },
        { "name": "is_group", "value_type": "boolean" }
      ]
    },
    {
      "api_name": "GroupAccount",
      "type_group": "g8.finance",
      "implements": ["IResource", "IIdentified"],
      "primary_key": "id",
      "title_property": "code",
      "properties": [
        { "name": "code", "value_type": "string", "required": true },
        { "name": "ifrs_class", "value_type": "string" }
      ]
    },
    {
      "api_name": "FinancialStatementItem",
      "type_group": "g8.report",
      "implements": ["IResource"],
      "primary_key": "id",
      "title_property": "code",
      "properties": [
        { "name": "statement_id", "value_type": "enum:IS|BS|CF|EQUITY", "required": true },
        { "name": "code", "value_type": "string", "required": true },
        { "name": "sign", "value_type": "enum:NATURAL|REVERSE" },
        { "name": "is_parent_control", "value_type": "boolean" }
      ]
    },
    {
      "api_name": "ReportingLine",
      "type_group": "g8.report",
      "implements": ["IResource"],
      "primary_key": "id",
      "title_property": "code",
      "properties": [
        { "name": "projection_id", "value_type": "string", "required": true },
        { "name": "fs_item_id", "value_type": "string" },
        { "name": "formula_ref", "value_type": "string" }
      ]
    },
    {
      "api_name": "AccountMappingVersion",
      "type_group": "g8.finance",
      "implements": ["IResource", "IVersioned", "ISourced"],
      "primary_key": "id",
      "title_property": "id",
      "properties": [
        { "name": "local_account_id", "value_type": "string", "required": true },
        { "name": "group_account_id", "value_type": "string" },
        { "name": "fs_item_id", "value_type": "string" },
        { "name": "reporting_line_id", "value_type": "string" },
        { "name": "projection_code", "value_type": "enum:CORPORATE_MR|PETROLEUM_OPERATING_PL|GAS_GROUP_PL|STATUTORY_BS|STATUTORY_IS|GAS_CF" }
      ]
    },
    {
      "api_name": "AccountDimensionPolicy",
      "type_group": "g8.dimension",
      "implements": ["IResource", "IVersioned"],
      "primary_key": "id",
      "title_property": "account_family_pattern",
      "properties": [
        { "name": "account_family_pattern", "value_type": "string", "required": true },
        { "name": "required_dimension_ids", "value_type": "string[]", "required": true },
        { "name": "evidence_state", "value_type": "enum:OBSERVED_LABEL_ONLY|RULE_EVIDENCED|UNKNOWN", "required": true },
        { "name": "slot_note", "value_type": "string" }
      ]